{
  "schema": "moonpi-component",
  "schema_version": 1,
  "revision": 1,
  "id": "moonpi.logic.condition",
  "name": "Condition",
  "category": "Automation",
  "description": "Passes a trigger only while the condition is true.",
  "aliases": [],
  "driver": {
    "id": "moonpi.driver.condition",
    "api_version": 1
  },
  "connections": [],
  "ports": [
    {
      "id": "condition",
      "type": "Boolean",
      "direction": "input"
    },
    {
      "id": "trigger",
      "type": "Trigger",
      "direction": "input"
    },
    {
      "id": "then",
      "type": "Trigger",
      "direction": "output"
    }
  ],
  "properties": {},
  "electrical": {
    "logic_voltage": 0,
    "max_current_ma": 0,
    "requires_level_shifter": false,
    "requires_resistor": false,
    "safe_state": false,
    "notes": "Virtual node; no direct hardware access."
  },
  "documentation": "docs/GRAPH_FORMAT.md"
}
