{
  "schema": "moonpi-component",
  "schema_version": 1,
  "revision": 1,
  "id": "moonpi.logic.counter",
  "name": "Counter",
  "category": "Logic",
  "description": "Counts triggers; reset returns to zero.",
  "aliases": [],
  "driver": {
    "id": "moonpi.driver.counter",
    "api_version": 1
  },
  "connections": [],
  "ports": [
    {
      "id": "increment",
      "type": "Trigger",
      "direction": "input"
    },
    {
      "id": "reset",
      "type": "Trigger",
      "direction": "input"
    },
    {
      "id": "value",
      "type": "Integer",
      "direction": "output"
    }
  ],
  "properties": {},
  "electrical": {
    "logic_voltage": 0,
    "max_current_ma": 0,
    "requires_level_shifter": false,
    "requires_resistor": false,
    "safe_state": false,
    "notes": "Virtual node; no direct hardware access."
  },
  "documentation": "docs/GRAPH_FORMAT.md"
}
