{
  "schema": "moonpi-component",
  "schema_version": 1,
  "revision": 1,
  "id": "moonpi.logic.to_float",
  "name": "Integer to number",
  "category": "Data",
  "description": "Converts an integer into a numeric value.",
  "aliases": [],
  "driver": {
    "id": "moonpi.driver.to_float",
    "api_version": 1
  },
  "connections": [],
  "ports": [
    {
      "id": "input",
      "type": "Integer",
      "direction": "input"
    },
    {
      "id": "value",
      "type": "Float",
      "direction": "output"
    }
  ],
  "properties": {},
  "electrical": {
    "logic_voltage": 0,
    "max_current_ma": 0,
    "requires_level_shifter": false,
    "requires_resistor": false,
    "safe_state": false,
    "notes": "Virtual node; no direct hardware access."
  },
  "documentation": "docs/GRAPH_FORMAT.md"
}
